"3 nights in MELBOURNE, AUSTRALIA | Solo City Tour | Part 1 of 2",https://www.youtube.com/watch?v=g8hEyxlSe4E
Melbourne 5 New Metro Tunnel Stations Walkthrough Full Tour,https://www.youtube.com/watch?v=B8SDTso3wHc
Melbourne Australia Christmas Walking Tour 2025,https://www.youtube.com/watch?v=vrCnJRsj7VE
Melbourne Australia City Walk in Summer 2026,https://www.youtube.com/watch?v=WVWGjd_zotM
Melbourne Australia Saturday Night City Walk May 2025,https://www.youtube.com/watch?v=cjq1CaLMygk
Melbourne Australia Saturday Walk August 2025 Winter 4K Video,https://www.youtube.com/watch?v=XggZku21SH4
Melbourne Australia Saturday Walk in the City Winter Season,https://www.youtube.com/watch?v=9FvN1QmKpJ4
Melbourne Australia Summer Walk 2026 | Queen Victoria Market,https://www.youtube.com/watch?v=M8wsfTTrclM
Melbourne Australia at Night in Winter 2025 City Update,https://www.youtube.com/watch?v=VxONMFPMrTQ
Melbourne Australia in June 2025 City Walk 4K Video,https://www.youtube.com/watch?v=u72eMnmhAes
Melbourne Australia in September 2025 Wednesday Walk 4K Video,https://www.youtube.com/watch?v=PZHxqjM-0b8
Melbourne CBD Walking Tour | Elizabeth St to Southbank Promenade,https://www.youtube.com/watch?v=lz7gUY77SLk
Melbourne CBD summer city tour 2025 in  4k |Melbourne 4k walk,https://www.youtube.com/watch?v=Yuy4A_mpmMU
Melbourne City Evening Walk-4K,https://www.youtube.com/watch?v=Te3ZQzJCC14
Melbourne City Walk 4K 🇦🇺 | CBD Walking Tour | Saturday Afternoon in Melbourne,https://www.youtube.com/watch?v=KW85PISjaE0
Melbourne Is Magical To Walk During The Festive Season,https://www.youtube.com/watch?v=sevDXrQzmLg
Melbourne Stunning to WALK on Any DAY or Night,https://www.youtube.com/watch?v=JRoVqiLU9T0
Melbourne hits hottest day in 17 years 4K Walk,https://www.youtube.com/watch?v=RGpj2bnhUxc
Melbourne Is Stunning To Walk,https://www.youtube.com/watch?v=A9mmA-JM6O0
Melbourne is Stunning on Any Walk 4k,https://www.youtube.com/watch?v=MGSo_r4SkZw
Walking Sunny Melbourne - 4K,https://www.youtube.com/watch?v=DS7cdyrcdDk
Walking Tour of Melbourne City Centre [4K】,https://www.youtube.com/watch?v=Qz6X4Bfq4eI
St Kilda Melbourne Walk Tour 2025 Exploring Albert Park | Lakeside Stadium & St Kilda Cricket Ground,https://www.youtube.com/watch?v=2L9sVIroaW0
"Melbourne, AUSTRALIA Walking Tour with Captions & BEACH WALK [4K/60fps]",https://www.youtube.com/watch?v=Prz2VJOdtEE
Melbourne CBD Walking Tour 🇦🇺 | Australia’s Most Liveable City (4K),https://www.youtube.com/watch?v=KFxI1IauKro
Melbourne CBD Walking Tour 4K 🚶‍♂️ | City Life & Street Vibes,https://www.youtube.com/watch?v=kji0sSpyIls
Melbourne’s NEW Town Hall Station Opens! 🚆 | First Look & Walking Tour,https://www.youtube.com/watch?v=fcb2Gr0sn3o
Melbourne City Tour Part-1 | Melbourne City Walk Tour | Deol Travel Vlogs | Melbourne (Australia),https://www.youtube.com/watch?v=rxTac4P9DLQ
A Quiet Morning Walk along South Wharf Promenade | Melbourne CBD Australia Walking Tour 4K,https://www.youtube.com/watch?v=8rmh2_CcOWM
HIGHPOINT SHOPPING CENTRE WALK | MELBOURNE AUSTRALIA,https://www.youtube.com/watch?v=1wFlXMr3UFk
Melbourne Australia Walking Tour In May 2025 Night Walk In Melbourne 4K,https://www.youtube.com/watch?v=JkRTYZWHdpQ
"Melbourne, Australia's Largest City Virtual Tour",https://www.youtube.com/watch?v=uLDUG5bOAgM
"Parkmore Shopping Centre Walking Tour in Melbourne, Australia (4K 60fps)",https://www.youtube.com/watch?v=csPWL_AwpM4
REAL Australian ASMR That Nobody Talks About | Melbourne CBD Walking Experience,https://www.youtube.com/watch?v=WtJcUho3sUM
"Richmond Melbourne Suburb Walking Tour. Hot Summer Day, Quiet Relaxing Walk 4K",https://www.youtube.com/watch?v=7Oy6ZbVhJSU
WALKING Melbourne on a HEAVY Rainy Day In 4K Video,https://www.youtube.com/watch?v=ZKeHUcShKTY
"Westfield Knox Shopping Centre Walking Tour in Melbourne, Australia (4K 60fps)",https://www.youtube.com/watch?v=sLGI5SJNkuo
Exploring Flinders Lane’s East End | Melbourne CBD Walking Tour | Australia 4K Winter Walk,https://www.youtube.com/watch?v=VGD6lP_alwg
Adelaide to Melbourne by Train — Christmas Shopping & CBD Walking Tour,https://www.youtube.com/watch?v=spnhyUX529M
Melbourne City & DFO South Wharf Shopping Walk,https://www.youtube.com/watch?v=zckL8-QrkT4
Exploring Melbourne 2023,https://www.youtube.com/watch?v=AnJGvUqN3Dk
Melbourne Australia | Melbourne Cricket Ground | Taylor Swift in the City,https://www.youtube.com/watch?v=lxPHhDWL3Wc
Melbourne Australia in Summer February 2025 4K Video,https://www.youtube.com/watch?v=99fUkj2NhIc
Melbourne Celebrates the End of Ramadan 2023,https://www.youtube.com/watch?v=pZ3QQk21cv0
"Melbourne City | 10,000 Kazoos | Fed Square",https://www.youtube.com/watch?v=rB3sYO74vEQ
Melbourne Red Bull Billy Cart Race 2022 Australia,https://www.youtube.com/watch?v=LprHsQeDoe8
Melbourne in February - Afro Caribbean Carnival 2024 - Fed Square,https://www.youtube.com/watch?v=NGqXOpheILk
Melbourne's Best Foods + Coffee Culture  (Victoria Market | Coffee Street | Free Museum),https://www.youtube.com/watch?v=b6GVRIZQ81I
NEPAL FESTIVAL MELBOURNE 2022,https://www.youtube.com/watch?v=b-VpJ-pOn_M
Ultimate Australian Food Tour!! 🇦🇺 TOASTY HEAVEN + Best Kebabs in Melbourne!!,https://www.youtube.com/watch?v=3xAG5f5waDw
WALKING AND EXPLORING FLENDER STREET MELBOURNE CITY ( Australia ),https://www.youtube.com/watch?v=OwQBd6A7lmE
WALKING TOUR MELBOURNE CBD | Swanston Street Walk | February 2020 a week before lockdown,https://www.youtube.com/watch?v=tKz10ssruYc
WESTFIELD PLENTY VALLEY | MELBOURNE AUSTRALIA,https://www.youtube.com/watch?v=VKgmM4Wq338
"Walking Tale #8 - Melbourne, Australia | Junaid Akram",https://www.youtube.com/watch?v=u75DHOwEZO0
Walking Tour of Melbourne | Top 10 Laneways,https://www.youtube.com/watch?v=qEjxMZtFgUg
What's the BEST SHOPPING MALL in MELBOURNE CITY Right Now?,https://www.youtube.com/watch?v=rnkczNT-jw4
The Best 48 Hours in Melbourne! Exploring the CBD & Beyond | Travel Guide Melbourne City Vlog,https://www.youtube.com/watch?v=OWc1z3feAMk
"MELBOURNE VLOG♡ ST KILDA BEACH, WHERE TO EAT, SHOPPING & BOTANIC GARDENS | CHLOEWHITTHREAD",https://www.youtube.com/watch?v=Dbyqd2wTyhY
MELBOURNE International AIRPORT Walk 4K [2025] With Captions,https://www.youtube.com/watch?v=el05Nm4a6ng
"Crown Towers Melbourne, Australia - Hotel Review & Impressions【Full Tour 4k】",https://www.youtube.com/watch?v=znDZo1AHx_w
Christmas Walk In Melbourne - Holiday Season Walking Tour 4K,https://www.youtube.com/watch?v=YWCgtFsenrw
Epping Plaza Shopping Centre Mall - Melbourne Australia 🇦🇺 4k Walking Tour,https://www.youtube.com/watch?v=h9NZfCMqV28
Experience Melbourne Australia in Spring October 2025 4K Video,https://www.youtube.com/watch?v=HGbX_VVy5NA
Experience Melbourne Australia in Summer 2026 | Walkthrough Inside Flinders Street Station,https://www.youtube.com/watch?v=UcDObXG441U
Experience Melbourne Australia in Winter August 2025 4K Video,https://www.youtube.com/watch?v=45Bh_a8Csww
First Month of Autumn in Melbourne City Australia 2025 Walking Tour,https://www.youtube.com/watch?v=Kn31hQls4MI
[HD] Melbourne Late Noon Walking Tour ~ Swanston St - Flinders Station - Southbank - Elizabeth St,https://www.youtube.com/watch?v=lhGQhU3wywo
MELBOURNE Christmas Eve Walk 2025 ( Live Recording),https://www.youtube.com/watch?v=ZSmBiNOTqfo
MELBOURNE is Stunning on a Clear Day and Night Walk,https://www.youtube.com/watch?v=SOrGSp0K3r4
Melbourne 15-minute City Walk,https://www.youtube.com/watch?v=lPSYwnqudaY
"Melbourne 4K Walking Tour | Melbourne CBD, Yarra River Promenade 🇦🇺Australia Dec 2025",https://www.youtube.com/watch?v=0yWRaXbgUGM
Melbourne 4k Day Walk,https://www.youtube.com/watch?v=bkrilTknzVc
"Melbourne, AUSTRALIA - Evening Stroll in the City of Melbourne 4K Walking Tour",https://www.youtube.com/watch?v=XQX6oaBi0oQ
