4K UHD Walk | Tarneit Suburb to Melbourne CBD 🇦🇺 | Australia in Stunning Detail,https://www.youtube.com/watch?v=CdEg8h7pMk4
A Day Out in Melbourne City | 4K Walking Tour | Christmas Carnival | The Melbourne Walker,https://www.youtube.com/watch?v=bKMUadjEG-A
A Scenic Car Tour Through the Beautiful Streets of Melbourne Australia City of Beauty,https://www.youtube.com/watch?v=qf1NISCh4GI
A Tour of MELBOURNE | The Coolest City in Australia?,https://www.youtube.com/watch?v=6O8ngGnBWhs
Another Walk Through Melbourne // Parliament to Southern Cross!,https://www.youtube.com/watch?v=Uo43CH1DBMw
Australia - 3 days in MELBOURNE! (1080p HD) | Magda T,https://www.youtube.com/watch?v=T3mHX4wU614
Australia Tour | Melbourne Episode 1 | Day 1 in Melbourne | My Dream Travel #australia,https://www.youtube.com/watch?v=W7djnjwzpo0
Discover English City tour of Melbourne,https://www.youtube.com/watch?v=0WoyxiKWqyU
FLYING TO MELBOURNE | INDIANS IN AUSTRALIA #hindivlog,https://www.youtube.com/watch?v=e1fvNrZ5ErA
How to Spend 3 Days in Melbourne Australia 2025 | The Perfect Travel Itinerary,https://www.youtube.com/watch?v=ne685j-D2vk
"I Am Walking Around In Melbourne City At Night, Australia",https://www.youtube.com/watch?v=Xt5tnIaqhTg
Indonesian Community Melbourne Australia | Moomba Festival 2023,https://www.youtube.com/watch?v=btGOA4aLfxo
"मेलबर्न - ऑस्ट्रेलिया का सबसे शानदार शहर // Interesting Facts About Melbourne, Australia in Hindi",https://www.youtube.com/watch?v=s2ywNkf8J5w
"Is this the best of Melbourne, Australia? Discover Southbank 😍 (vlog3)",https://www.youtube.com/watch?v=DrOpCftfylo
"Las casitas de Brighton de Melbourne, Australia",https://www.youtube.com/watch?v=4c2mFojJqW4
MELBOURNE - Autumn City Tour,https://www.youtube.com/watch?v=VcLJRsPwSws
MELBOURNE CITY AUSTRALIA DOCKLANDS WALKING TOUR 2020,https://www.youtube.com/watch?v=pgpkb1In4kU
MELBOURNE CITY CENTER CBD TOUR - TRAVEL GUIDE AUSTRALIA 2019,https://www.youtube.com/watch?v=eRXB0rwer0s
MELBOURNE CITY CENTER TOUR -  TRAVEL GUIDE AUSTRALIA 2019,https://www.youtube.com/watch?v=nG-ymI_a2bQ
MELBOURNE CITY CENTRE - AAMI PARK STADIUM TOUR,https://www.youtube.com/watch?v=nXINbSOMvbo
MELBOURNE CITY CENTRE TOUR CHRISTMAS AUSTRALIA 4K,https://www.youtube.com/watch?v=Q1g_S70rtTM
MELBOURNE Travel Vlog | Day 6 | Melbourne City 4K Solo Walking Tour Part 1,https://www.youtube.com/watch?v=CadT5B8LyJU
"Melbourne, Australia - The coolest city in the world (Eras Tour) - Down Under Travel Vlog #3",https://www.youtube.com/watch?v=3xpjftSnkwA
"Melbourne, Australia 4K Ultra HD • Stunning Footage, Scenic Relaxation Film with Calming Music.",https://www.youtube.com/watch?v=rzlgaWR8w00
Melbourne Australia 4K Walk : Walking Tour Along With Piano Calming Music Tuneone and Drone View,https://www.youtube.com/watch?v=u5s_6A2CeBE
Melbourne Bus City Tour 1,https://www.youtube.com/watch?v=rxrOfTUJY6o
Melbourne Central Shopping Centre-Train Station Walking Tour Australia 2022 | AvatarTripTrek,https://www.youtube.com/watch?v=Q--PCIZ3DAk
Melbourne City: Burke Street to QV Melbourne Walk  #melbourne #melbournecity #walking #phoena,https://www.youtube.com/watch?v=MT6Yq4EzbTM
Melbourne City : Flinders Street to Burke Street Walk  #melbourne #walking #city #phoena,https://www.youtube.com/watch?v=iKLwio_et8Y
Melbourne City එකේ රවුමක් දාමුද?යාලුවනේ💃🇦🇺| Melbourne City Tour | Sinhala Vlogs | Street Foods 🤤🧇🍱🥓🍝,https://www.youtube.com/watch?v=bFGbizs274g
Melbourne City Tour in a Rainy Day,https://www.youtube.com/watch?v=I_9x4jW9k2g
Melbourne City Tour with Family | Ep 27  | Australia Tour | Latest Punjabi Vlog 2023,https://www.youtube.com/watch?v=7a_fvT2_VeQ
Melbourne City Vlog | Exploring The State Library | Delicious Foods | Window Shopping 🛍️📚🤤,https://www.youtube.com/watch?v=MNLAbqiovV8
Melbourne I LOVE YOU | Melbourne City tourist attractions | Walking tour Melbourne City,https://www.youtube.com/watch?v=0oXeerQ64Pk
Melbourne TRAVEL GUIDE | Melbourne Victoria Australia City Tour | Things To Do In Melbourne,https://www.youtube.com/watch?v=3Rlc37AXwHg
Melbourne TRAVEL GUIDE PART 4 | Melbourne Victoria Australia City Tour,https://www.youtube.com/watch?v=kKneAG07_Mk
Melbourne The Most Liveable City in Australia,https://www.youtube.com/watch?v=5JEURBulIkc
Melbourne | Travel With Chatura,https://www.youtube.com/watch?v=wmr-B3EDr8s
"Melbourne VLOG 🇦🇺 | Best Croissants in Melbourne, Relaxing day, Melbourne City Tour",https://www.youtube.com/watch?v=drrZzeNJVdQ
Melbourne Vacation Travel Guide | Expedia,https://www.youtube.com/watch?v=RLOsQViPLhw
"আমাদের মেলবোর্ন ট্যুর – Melbourne, the most livable city in Australia and world. Tourist vlog Bangla",https://www.youtube.com/watch?v=AQJ7YJNsTtM
My parents tour to Melbourne City 2025,https://www.youtube.com/watch?v=4cp5z66SOuQ
Our First Time in Melbourne Australia.. (Coolest City Ever??),https://www.youtube.com/watch?v=_rJ9XpWf5b0
"SYD to MEL: First Day in Melbourne, Australia! 🇦🇺",https://www.youtube.com/watch?v=eoz8cri7gog
🇦🇺 Ultimate Travel Guide to the Melbourne CBD,https://www.youtube.com/watch?v=TRHoWhXrK1c
University of Melbourne Campus Tour | Visited my university,https://www.youtube.com/watch?v=DGh2fL82Oa8
Vlog 30 | A tour around Melbourne CBD (Part 1) | Australia,https://www.youtube.com/watch?v=6hSRb_aLf2k
"Vlog 4 - 🚶‍♀️ Walking Tour - CBD, Melbourne (THU, 5 SEPT 2024)",https://www.youtube.com/watch?v=mngxfdlq9tk
🌆 World's Most Liveable City -Tour | Melbourne City Walk | Australia Tamil Vlog | Melbourne Macha,https://www.youtube.com/watch?v=TRHFFclYo5Y
MELBOURNE Australia: City Tour + BEST Tourist Attractions & Hotel in CBD (Travel Vlog)| Sophie Ramos,https://www.youtube.com/watch?v=w_Gd5PP8HRI
Insane First Impression Melbourne! - Best Things To Do & Eat | Australia 🇦🇺,https://www.youtube.com/watch?v=IpTOziob6pk
A DAY IN MY LIFE 📆👩🏻 | MELBOURNE CITY TOUR 🚊🏙️ & CAFE BRUNCHIN ☕️🍛 | April Tan,https://www.youtube.com/watch?v=XBvdlWnhLRo
Melbourne Night Walk｜Lo-Fi × City Pop 🌃🚶‍♂️｜Chill & Focus BGM｜90 BPM,https://www.youtube.com/watch?v=F_ITjCH44jI
Walking Around Melbourne City Part1 | Melbourne Street Art | Cecille’s Vlog,https://www.youtube.com/watch?v=48y3Tl4ejAw
MELBOURNE AUSTRALIA Walking City Tour: MUST See & Do + BEST Food & Travel Guide! | Sophie Ramos,https://www.youtube.com/watch?v=Jg8vuuf3B0s
Bread Pete  Melbourne Trip 2025  (City Walk to the MCG - Race Bib collection ) - Part 4 9 Oct 2025,https://www.youtube.com/watch?v=MOAenWECLfM
Melbourne: Victoria Hotel Staycation - Part 2 - AUS 2025,https://www.youtube.com/watch?v=CgXleNiuz-4
Melbourne City Walk: Yarra River/ Birrarung Marr | Is This Really Australia?,https://www.youtube.com/watch?v=Y3A8PFOxdz4
Melbourne City Walk After Rain | Bourke Street to Collins Street,https://www.youtube.com/watch?v=h5GGlLEU6y4
Melbourne CBD at Christmas | EPIC Myer LEGO Window Display City Walk,https://www.youtube.com/watch?v=O3CpUo8qJss
Melbourne Nightlife in 4K | Uncut Friday Walking Tour on Chapel Street,https://www.youtube.com/watch?v=3dGMGR3y4N8
Melbourne walking tour,https://www.youtube.com/watch?v=2zMkDTBsjlE
"Melbourne 🎹 🚋 City Walk | Flinders Street Station, Trams, Royal Arcade & Street Pianist",https://www.youtube.com/watch?v=J57TmJxIEcY
"Melbourne City Walking Tour 🇦🇺 4K | CBD Streets, Laneways & Southbank #australia",https://www.youtube.com/watch?v=-lzEoxImaSg
